time,theme,url,title,article
2022.06.13 08:56,양돈기업,http://www.pigtimes.co.kr/news/articleView.html?idxno=45748,"선진, 신선식품 최초 삼성 큐커관 입점","선진의 ‘선진포크한돈’ ‘선진팜 한우’ ‘육가공 식품’ 등이 삼성닷컴의 큐커식품관에 입점한다. 현재 삼성닷컴의 큐커식품관에는 다양한 식품기업들이 입점해있으나 신선식품으로는 선진의 ‘선진포크한돈’ ‘선진팜 한우’ 입점이 최초다.선진은 이번 삼성닷컴 입점에 맞춰 돈육 제품 21종(일반 돈육 제품 14종, 동물복지 돈육 7종), 무항생제 한우 제품 14종, 육가공 4종을 함께 출시해 가정에서 간편하게 즐길 수 있는 제품들을 선보였다.특히 가정에서 고기를 쌈에 싸 먹던 방식을 넘어 지금은 스테이크 등 다양한 조리법이 대중화되어 있는 만큼 각 메뉴에 맞는 ‘선진포크한돈’만의 제품을 개발했다. ‘명품진 날씬삼겹’은 쌈으로 먹을 때 가장 맛있게 출시된 삼겹살로, 바삭하고 촉촉한 식감을 위한 최적 두께를 찾았다. ‘명품진 목살’은 스테이크 요리에 적합하게 개발되었으며 육즙 손실 없이 부드러움이 극대화될 수 있으면서도 큐커를 이용한 초간편 구이법으로 조리할 수 있다.학교 급식 시장에서 특히 사랑받고 있는 선진 육가공 제품은 이번 큐커 입점을 통해 다인 가족 고객의 입맛을 사로잡겠다는 계획이다. 소스와 함께 포장되어 편리함까지 갖춘 ‘육즙가득 비프함박스테이크’와 ‘데리야끼 멘츠카츠’가 주력 제품으로 큐커 식품관 쿠폰과 함께 사용하면 6월 한달 간 100원에 구매하는 행사를 진행 중이다.선진은 큐커 맞춤형 전용 제품, 스캔쿡 레시피를 별도 설정하기도 했다. 돼지고기 전문 셰프가 수천 번 테스트하여 돼지고기를 간편하면서도 맛있게 먹을 수 있는 레시피를 ‘선진포크한돈’으로 구현했다.삼성닷컴 큐커식품관 입점에 맞춰 선진의 특가전도 마련되었다. 1일 30개 한정 무항생제 1+한우 40% 파격 할인이 진행된다. 또한 선진 전 상품에 사용 가능한 5천원 할인쿠폰도 증정된다. 특가전은 이달 30일까지 진행될 예정이다.김대승 Meat&Food혁신센터장은 “선진은 가정식 조리의 패러다임 변화에 따라 편의성을 극대화하면서도 맛과 풍미를 높인 큐커 전용 제품들을 개발했다. 앞으로도 건강하고 맛있게 즐길 수 있는 제품을 지속적으로 연구하고 출시해 글로벌 종합식품기업으로 나아가겠다”고 전했다.저작권자 © 양돈타임스 무단전재 및 재배포 금지양돈타임스다른기사 보기 "
2022.06.13 08:55,양돈기업,http://www.pigtimes.co.kr/news/articleView.html?idxno=45749,"(주)금돈, 기업부설연구소 설립","㈜금돈이 지난 5월 기업부설연구소를 설립하고 초대 소장에 최재관 박사(전 축산과학원)를 영입했다.연구소는 ㈜금돈의 육종과 인공수정 등 최고의 종돈을 생산하기 위해 설립됐다. 이에 한 차원 높은 단계의 육종관련 업무가 진행될 예정이다.이번 기술연구소 설립으로 관련업체인 ㈜금보DDF, 금보유전자, 금보육종 등 종돈의 육종과 사양업무를 지휘하게 돼 더 우수한 종돈을 생산하는데 큰 도움이 될 것으로 기대되고 있다.저작권자 © 양돈타임스 무단전재 및 재배포 금지양돈타임스다른기사 보기 "
2022.06.10 15:35,오늘의 뉴스,http://www.pigtimes.co.kr/news/articleView.html?idxno=45750,강원남부 돼지 타도 반출 조건부 허용,"이동제한 이후 강원지역의 한 양돈장.정부가 강원 홍천 지역에서의 ASF 추가 발생이 없다고 판단, 조건부로 강원 홍천 및 남부권역 돼지의 타도 반출입을 재개했다.농림축산식품부는 최근 강원 홍천 아프리카돼지열병(ASF) 발생에 따라 확산 방지를 위해 강부 남부권역과 타지역 간 돼지 반출입을 금지하고, 충북 북부 및 경북 북부 권역화 지역 돼지 반출 시 검사를 강화했다.이와 관련, 농축산부는 발생 이후 2주간 추가 발생이 없고 정밀검사에서 이상이 없는 점 등을 감안, 10일부로 강원 남부권역의 타권역 돼지 반출입을 방역 관리 하에 허용키로 했다. 또한 홍천 ASF 발생에 따른 이동제한중인 양돈농장(발생농장 역학관련 또는 방역대 내 농장)에 대하여 출하요령에 따라 출하가 가능해졌다. 강원 남부, 충북 북부, 경북 북부 권역화 지역 정밀검사 방법강원 남부, 충북 북부, 경북 북부 권역화 지역 정밀검사 방법"
2022.06.15 18:02,오늘의 뉴스,http://www.pigtimes.co.kr/news/articleView.html?idxno=45751,고돈가도 소용없다…사육의지 저하,"지난해에 이어 올해도 고돈가가 이어지고 있지만 양돈농가들은 두수를 늘릴 의지가 없는 것으로 보인다. 되레 돼지 사육두수가 줄 것으로 추산되고 있다.최근 농촌경제연구원은 농업관측센터 표본농가(111호) 조사 결과 6~10월까지의 모돈 사육의향이 일제히 전년 대비 감소했다고 밝혔다. 지난해 6월을 100으로 봤을 때 지난해는 10월까지 모두 100 이상을 기록한 반면 올해는 전년 동기보다 0.2~0.3% 낮은 것으로 분석됐다. 지금까지의 양돈 시장 상황으로 봤을 때 의아할 수 있는 결과다. 올해 돼짓값은 5월말 평균 4천831원으로 전년 동기간 4천140원보다 16.7% 올랐다. 그럼에도 농가들은 향후 양돈업에 대한 기대보다 불안감이 더 큰 것으로 해석할 수 있다.농가들의 불안을 높이는 요인으로는 무엇보다 생산비 부담이 큰 것으로 짐작된다. 국제 곡물가 상승으로 지난해에 이어 올해도 사료비가 인상되고 있으며 최근 우크라이나 사태 장기화와 곡물 주산지의 기상 악화 등으로 생산비가 더 오를 수 있는 상황인 때문이다.이에 농경연은 향후 사육두수와 관련, 12월 전체 사육두수는 1천160만9천마리, 이 중 모돈은 97만5천마리로 전년 대비 각각 2%, 0.5% 감소할 것으로 전망했다. 또 6월도 전체 사육두수는 1천198만5천마리로 지난해보다 2% 가량 많지만 모돈은 97만6천마리로 일년전보다 0.2% 적을 것으로 분석했다.저작권자 © 양돈타임스 무단전재 및 재배포 금지임정은다른기사 보기 "
2022.06.10 15:49,오늘의 뉴스,http://www.pigtimes.co.kr/news/articleView.html?idxno=45752,[6월 전망] 6천원 이상…공급은 줄 듯,"6월 돼짓값도 6천원 이상 형성할 전망이다.최근 농촌경제연구원은 6월 양돈관측을 통해 6월 돼짓값이 6천~6천200원으로 전년(5천204원)보다 15.3~19.1%, 평년(5천43원) 대비 19~22.9% 오를 것으로 전망했다. 5월에 이어 6월에도 평균 6천원대의 고돈가가 지속될 것이란 얘기다. 5월(6천385원)보다는 다소 하락한 수준이지만 정부의 소상공인 손실보전금 지급에 따른 가격 추가 상승 요인이 있다고 농경연은 덧붙였다.6월은 공급량도 줄 것으로 추산됐다. 돼지 도축은 134만~138만마리로 5월(152만8천마리)은 물론 전년 동월(144만8천마리)에 비해서도 4.7~7.5% 감소할 것으로 내다봤다. 아울러 돼지고기 수입량은 3만2천~3만4천톤으로 전년 동월(3만2천503톤)에 견줘서는 3.1% 증가한 물량이지만 5월 4만톤보다 15~20% 가량 줄 것으로 예상했다.올해 5월까지 수입량이 20만1천여톤으로 전년 동기보다 55% 증가한 것을 감안하면 수출 증가세가 크게 둔화되는 셈이다. 농경연은 또 올 한해 수입량이 36만~38만톤에 이를 것으로 내다봤다. 전체 수입량으로는 올해가 전년(33만3천톤)보다 증가하지만 올해 5월까지 수입량(20만1천톤)을 감안할 때 하반기는 지난해보다 수입이 감소할 것이란 계산이 나온다. 즉 올 한해 예상 수입량에서 5월까지 수입된 물량을 빼면 올해 나머지 기간(6~12월) 수입량은 16만~18만톤으로 지난해 같은 기간 20만2천600톤보다 적다.아울러 올해 등급판정 두수는 1천820만~1천840만마리로 전년(1천836만6천마리)과 비슷하고 평년(1천775만마리)보다 2.5~3.7% 증가할 것으로 내다봤다. 농경연은 이에 대해 평년 대비 생산성이 높고 21년 하반기 모돈 사육의향 상승으로 올해 연평균 사육마릿수가 증가한 결과라고 설명했다.저작권자 © 양돈타임스 무단전재 및 재배포 금지임정은다른기사 보기 "
2022.06.15 09:21,오늘의 뉴스,http://www.pigtimes.co.kr/news/articleView.html?idxno=45753,매년 늘 던 5월 돈육 수입 줄었다,"5월 돼지고기 수입량이 전달보다 다소 준 가운데 부위별, 국가별로도 이전과는 다소 다른 추이를 보였다. 다만 전년 동기와 견주면 5월도 큰 폭의 증가세가 이어졌다.최근 식품의약품안전처에 따르면 5월 돼지고기 수입량은 3만9천900톤으로 전달 4만1천여톤보다 3.2% 줄고 전년 동월 2만9천톤에 비해서는 37% 증가했다. 이로써 5월말 돼지고기 수입물량은 20만1천톤으로 일년전 13만톤보다 54.7% 많았다.이처럼 전년 대비 증가세는 이어졌지만 올해처럼 5월 수입량이 전달보다 감소하는 경우는 드물다. 일반적으로 5월은 다가올 돼지고기 소비 성수기를 대비해 수입물량이 4월에 비해서는 증가하는 경우가 더 많아서다.한 가지 더 주목되는 것은 5월 수입량은 부위별, 국가별로도 이전까지의 흐름에서 다소 비껴나 있다. 즉 부위별로는 그동안 줄곧 최대 비중을 차지하던 삼겹살이 다소 줄면서 앞다리보다 적었고 국가별로는 역시 압도적인 1위를 지속하던 스페인이 큰 폭으로 감소해 미국이 다시 1위로 치고 올랐다.5월말 기준으로는 삼겹살 수입이 7만9천여톤으로 가장 많았다. 하지만 5월만 보면 1만5천톤으로 전달보다 8% 가량 준 반면 앞다리는 올 들어 가장 많은 1만6천여톤으로 2020년 5월 이후 2년만에 삼겹보다 많았다. 이 밖에 나머지 부위들은 5월말 현재 목심이 3만톤으로 일년전보다 70.6% 증가한 것을 비롯해 등심(6천800톤), 뒷다리(6천700톤), 갈비(4천800톤)는 3.6배, 19배, 2.8배 폭증했다.국가별로는 5월만 보면 미국이 1만2천여톤으로 전달보다 7.5% 늘고 스페인산이 전달보다 37% 급감한 8천600톤으로 지난해 12월 이후 처음으로 미국산이 다시 1위로 올라섰다.이와 관련해서 주목해볼만한 점은 미국과 EU의 돼짓값 추이다. 지난 3월 중순 이후 스페인을 비롯해 EU(유럽연합)의 돼짓값이 오르기 시작했고 반대로 미국은 비슷한 시기 하락세가 시작돼 지난 4월과 5월 각각 전년 대비 4.3%, 10% 낮았다.미국의 경우 지난 21년 이후 처음으로 전년 동월보다 돼짓값이 하락세로 돌아선 것이다. 미국과 EU 내 돼짓값 흐름이 국내 돼지고기 수입량 변화와 맞아떨어지고 있어 5월이 수입 돼지고기 시장의 추세적 변화를 시작하는 변곡점이었을지 추후 수입량 추이가 주목되고 있다.저작권자 © 양돈타임스 무단전재 및 재배포 금지임정은다른기사 보기 "
2022.06.10 17:57,시세,http://www.pigtimes.co.kr/news/articleView.html?idxno=45754,[6월 10일 시세] 6천원 안팎서 횡보세,"축산물품질평가원에 따르면 6월 10일 전국 축산물 도매시장(제주 제외)에서 경락된 비육돈은 964두로 전일 2천102두와 비교해 감소했다. 그럼에도 지육 kg당 탕박 평균 가격(제주 제외)은 5천868원을 기록하며 전일 6천71원보다 203원 하락했다.이번주 한돈 평균 가격이 간신히 6천원대에 턱걸이했다. 5월 평균 6천300원대서 물가 상승 및 공급 대비 한돈 수요 감소로 지속 하락하고 있다. 당분간 수요 심리 위축 심화로 다음주 6천원대가 유지될지, 5천원대로 하락할 지 분수령이 될 전망이다. 저작권자 © 양돈타임스 무단전재 및 재배포 금지양돈타임스다른기사 보기 "
2022.06.13 09:02,양돈기업,http://www.pigtimes.co.kr/news/articleView.html?idxno=45755,[광고]“PIF 레반이 악취‧슬러리 문제의 답입니다①”, 저작권자 © 양돈타임스 무단전재 및 재배포 금지양돈타임스다른기사 보기 
2022.06.13 09:31,시세,http://www.pigtimes.co.kr/news/articleView.html?idxno=45756,[주간시황] 소비 주춤…6천원대 분수령,"한돈가격이 6월에도 6천원대를 지속하고 있다.지난주 지육 kg당 가격(탕박 기준, 제주 제외)을 보면 7일 6천51원, 8일 5천997원, 9일 6천71원, 10일 5천868원을 형성했다. 최근 돼지 값은 현충일 연휴에 따른 산지 출하물량 증가로 그동안의 상승세가 주춤하면서 다소 하락했다. 또한 삼겹 소비자가격 급등에 따른 소비 주춤도 한돈가격 형성에 영향을 미치고 있다.6월 둘째 주(6월7일~6월10일) 산지 출하물량은 총 31만3천35두(일평균 7만8천258두)로, 전주(5월30일~6월3일) 30만1천681두(〃7만5천420두) 대비 일 평균 출하물량은 3.8% 증가했다. 전국 축산물 도매시장에서 거래된 비육돈은 총 7천400두(일평균 1천850두)가 출하, 전주 7천670두(〃1천917두)에 비해 3.6% 감소했다. 그럼에도 지육 kg당 탕박 평균 가격(제주 제외)은 6천18원으로 전주 6천195원에 견줘 177원 하락했다.한돈 삼겹 소비자 가격은 축산물품질평가원에 따르면 6월 9일 기준 100g당 2천866원을 형성, 전달(2천738원) 대비 높게 형성하고 있다. 전년 동월(2천562원) 대비해서도 높게 형성되고 있다.6월 한돈가격도 5월에 이어 6천원대의 강세를 형성하고 있다. 그러나 5월 대비 최근 한돈가격은 다소 하락, 6천원대를 아슬아슬하게 유지하고 있다. 이는 무엇보다 돈육 소비자가격 상승에 따른 소비 주춤 영향으로 풀이된다.유통업계에 따르면 어버이날 이후부터 구이류의 경우 판매 부진이 지속되고 있다고 밝혔다. 특히 외부활동 증가로 외식 판매는 증가세를 유지하고 있으나, 가정 소비가 크게 위축되면서 대형마트, 정육점, 온라인 등으로의 매출이 큰 폭으로 감소하고 있다고 분석했다. 이에 전체적으로 5월 연휴 대비 소비 감소세가 이어지면서 한돈가격도 조정을 받고 있다.따라서 6월 한돈가격은 5월 대비 낮을 것으로 전망된다. 아울러 내달부터 돈육 할당관세 냉장 삼겹살이 대형마트를 중심으로 공급되면, 높은 한돈 삼겹살과 비교되면서 한돈 소비에도 큰 영향을 미칠 것으로 우려된다. 이번주 한돈가격은 도매시장 출하물량 추이 및 소비 주춤 속 6천원대 유지의 분수령이 될 전망이다.6월7~10일 전국 한돈 도매시장 경락가격 및 경락두수(축산물품질평가원)"
2022.06.13 18:28,시세,http://www.pigtimes.co.kr/news/articleView.html?idxno=45757,[6월 13일 시세] 6천원대 재진입," 축산물품질평가원에 따르면 6월 13일 전국 축산물 도매시장(제주 제외)에서 경락된 비육돈은 2천249두로 전일964두와 비교해 증가했다. 그럼에도 지육 kg당 탕박 평균 가격(제주 제외)은 6천181원을 기록하며 전일 5천868원보다 313원 상승했다.금일 한돈가격이 6천원대에 재진입, 최근 6천원 안팎에서 횡보세가 나타나고 있다. 6월 들어 한돈시장은 물가급등으로 소비가 주춤한 상황이지만, 계절적 요인으로 인한 산지 출하물량 감소에 따른 육가공업계 재고 확보 경쟁으로 한돈가격은 지지되고 있는 것으로 풀이된다.  저작권자 © 양돈타임스 무단전재 및 재배포 금지양돈타임스다른기사 보기 "
2022.06.15 09:18,시세,http://www.pigtimes.co.kr/news/articleView.html?idxno=45758,[6월 14일 시세] 6천원대 지속,"축산물품질평가원에 따르면 6월 14일 전국 축산물 도매시장(제주 제외)에서 경락된 비육돈은 1천781두로 전일 2천294두와 비교해 감소했다. 그럼에도 지육 kg당 탕박 평균 가격(제주 제외)은 6천168원을 기록하며 전일 6천181원보다 13원 하락했다.한돈가격이 6천원대를 유지하고 있다. 지난주 연휴에 따른 산지 출하물량 증가로 한돈가격이 한 때 5천원대를 형성했으나, 금주 출하물량 감소세로 다시 6천원대를 형성하고 있다. 이에 당분간 한돈가격은 공급 물량이 주도하는 시장 흐름이 예상된다. 저작권자 © 양돈타임스 무단전재 및 재배포 금지양돈타임스다른기사 보기 "
2022.06.15 18:02,오늘의 뉴스,http://www.pigtimes.co.kr/news/articleView.html?idxno=45759,전쟁에다 폭염…곡물가 더 오르나,"우크라이나 전쟁에 이어 때 이른 폭염과 가뭄 등 이상 기후가 세계 곡물 시장을 긴장시키고 있다.최근 외신 등에 따르면 세계 곳곳에서 이상 고온이 나타나고 있는데 문제는 인도, 미국 등 세계적인 곡물 주산지에서는 이로 인해 곡물 작황이 우려되는 수준이라는 점이다. 인도는 지난달 일평균 최고 기온이 45도를 기록하는 가운데 50도를 웃도는 살인적인 더위가 기승을 부리고 있다. 이미 인도는 지난 3월 평균 기온 33.1도로 121년만에 최고 기록을 세운바 있다. 특히 인도는 폭염으로 밀 생산이 줄 것을 우려돼 밀 수출을 중단한 바 있다.미국에서도 폭염과 가뭄 상황이 심상치 않다. 남부 텍사스와 북동부 필라델피아, 매사추세츠 지역의 기온이 지난달 이미 35~40도를 기록하며 봄 같지 않은 폭염에 시달리고 있다. 더구나 남서부 지역의 가뭄이 심각한 상태로 이로 인해 농업용수가 부족해 농사를 포기하는 농가들이 늘고 있는 것으로 알려졌다. 지난달 미국에서는 호수 바닥이 드러나면서 변사체들이 발견됐다는 뉴스들이 보도됐는데 그 배경에는 지독한 가뭄이 있었던 것이다. 가뭄이 심해지면서 남부 캘리포니아를 비롯해 각 주는 비상사태를 선포하고 있다. 지난달 22일 미국 농무부는 옥수수 파종이 72% 진행됐다고 보고했는데 이는 과거 5년 평균인 79%에 미치지 못하는 수치다.유럽도 마찬가지로 스페인, 프랑스 등에서 기록적 폭염이 나타나고 있다. 프랑스의 경우 폭염과 함께 올해 심각한 가뭄을 겪고 있는데 이로 인해 곡물 생육 상황이 지속적으로 악화되고 있는 것으로 보고되고 있다. 프랑스는 유럽 최대 곡물 생산국이다.우크라이나 사태로 인해 이미 세계적인 식량 위기가 현실화된 상황서 다른 곡물 주산지들을 덮친 이상 기후가 곡물 가격 상승의 또 다른 도화선이 되지 않을지 우려가 깊어지고 있다.저작권자 © 양돈타임스 무단전재 및 재배포 금지임정은다른기사 보기 "
2022.06.15 18:02,오늘의 뉴스,http://www.pigtimes.co.kr/news/articleView.html?idxno=45761,"사료곡물시장, 우크라 충격 본격 시작","국제 곡물 가격 상승 충격, 이제부터 시작이다? 2020년 하반기부터 시작된 국제 곡물 가격 상승으로 국내 양돈 배합사료 가격이 지난해부터 연이어 인상된 가운데 올해 발발한 우크라이나 사태의 여파는 이제 본격적으로 국내 시장에 반영될 것으로 보인다.농촌경제연구원은 최근 발표한 국제곡물 6월호를 통해 국내 사료곡물 수입단가 지수가 2분기 162.8로 전분기(143.6)보다 13.4% 오르고 3분기는 이보다 8.6% 더 높은 176.9에 이를 것으로 분석했다. 올 1분기도 143.6으로 전분기보다 6% 가량 올랐지만 앞으로는 상승세가 더 가팔라 질 것이라는 얘기다. 또 전년 동기간에 견줘서는 2분기와 3분기 각각 47%, 38% 높을 것으로 추산됐다.농경연은 이에 대해 2분기의 경우 밀 공급 부족 우려와 남미 작황 부진, 21년 4분기~22년 1분기 곡물 가격 상승시기 구매한 물량이 반입되는 영향이라고 설명했다. 또한 최근 미국 금리 인상 등으로 크게 오른 대미 환율 상승도 보태진 결과다. 3분기부터는 본격적으로 러시아-우크라이나 전쟁 이후 곡물 가격이 크게 상승한 1~2분기 구입한 물량이 도입되면서 수입 단가 상승세가 지속될 것이란 전망이다. 우크라이나 사태가 2월말 이후 시작되면서 국제 곡물 가격도 다시 한번 급등했는데 이제 그 여파가 본격적으로 국내 시장에도 반영될 것이란 얘기이기도 하다.실제 5월(1~20일 평균)만 보더라도 사료용 곡물 수입 단가(톤당)는 밀 336달러, 옥수수 361달러로 전년 동월 평균 대비 25%, 47% 상승했다. 여기다 원/달러 환율은 일년전 1천120원대서 지난달 1천270원에 육박하며 사료 곡물 수입단가 상승 요인이 되고 있다.저작권자 © 양돈타임스 무단전재 및 재배포 금지임정은다른기사 보기 "
