time,theme,url,title,article
2022.05.25 15:11,오늘의 뉴스,http://www.pigtimes.co.kr/news/articleView.html?idxno=45647,유럽산 종돈 수입 열기 ‘시들’,"최근 유럽산 종돈 수입 열기가 시들해지고 있다. 최근 종축개량협회에 따르면 금년 5월 25일 기준 종돈 수입 두수는 609두로 작년 동기간 426두보다 42.5% 증가했다. 이는 신규 종돈장 입식 수요 및 지난해부터 이어진 돈가 안정 영향으로 풀이된다. 금년 눈여겨 볼 점은 현재까지 유럽산 종돈 수입은 ‘제로’를 기록한 반면 캐나다산 종돈 수입이 100% 이뤄졌다는 점이다. 이는 최근 북미산 종돈에 대한 양돈장 니즈 및 유럽산 돼지고기에 대한 육가공업체의 불만 제기로 종돈장들 역시 다시 북미산에 대한 점유율을 높이고 있는 것으로 분석된다.2012년 이후 다산에 강점이 있는 프랑스산 종돈을 시작으로 2016년부터 덴마크산도 급격히 증가, 한 때는 유럽산 종돈 수입 점유율이 북미산 보다 높게 형성됐다. 즉 다산성의 큰 장점이 있는 유럽산 종돈에 대한 국내 종돈장들이 관심이 나날이 커진 것이다.그러나 유럽산 다산 종돈에서 태어난 자돈 생시 체중 저하와 함께 어려운 관리가 문제로 떠오르고, 유럽 종돈 후대축 돼지고기에 대한 육질 문제도 불거졌다. 이에 최근 한 계열업체가 유럽산 종돈에서 북미산으로 선회하는 등 시장의 냉정한 평가를 종돈장들도 받아들이고 있다.종돈업계의 한 관계자는 “그동안 유럽산 종돈 수입이 늘어난 배경에는 다산 모돈을 통한 농가 수익 증가에 대한 관심이 반영된 결과이다”며 “그러나 유럽산 종돈 관리가 어렵고, 돼지고기 품질 문제 또한 불거지면서 농가‧소비자 모두 만족하지 못하면서 다시 북미산 종돈이 각광받고 있다”고 말했다.저작권자 © 양돈타임스 무단전재 및 재배포 금지김현구다른기사 보기 "
2022.05.23 09:17,오늘의 뉴스,http://www.pigtimes.co.kr/news/articleView.html?idxno=45648,"“국회의원님, 사료값 대책 세워주세요”","한돈협회가 사료 가격 급등 긴급 대책 마련을 국회에 호소했다.협회는 지난 19일 사료가격 급등 위기 사항을 극복하기 위해 사료구매자금 등 주요 정책자금의 금리 인하 및 상환시기 연장을 국회 예산결산특별위원회, 기획재정위원회, 농림축산식품해양수산위원회에 건의했다.협회는 국제 곡물가격 및 환율 상승 등의 영향으로 옥수수, 대두박, 소맥 등 주요 사료원료의 도입 비용이 폭등하고 있는 가운데 양돈용 배합사료 가격은 작년에만 30% 급상승하고 올해 하반기에도 20% 추가 인상이 예상되는 상황이라고 토로했다. 특히 한돈농가의 경우 최근 돈가 상승에도 사료가격이 돼지 생산비의 대부분(50%∼60%)을 차지하는 상황에서, 올 하반기에는 한돈농가의 약 30%가 도산 위기에 직면한 심각한 상황이라고 호소했다.따라서 협회는 사료가격 급등 위기상황을 극복하기 위한 긴급대책으로 사료구매자금, 특별사료구매자금, 긴급경영안정자금등의 주요 정책자금의 금리를 무이자로 지원하고, 상환시기 도래 또는 거치기간 만료 시 2∼3년 연장 조치가 반드시 필요하다고 주장했다.이에 국회 차원에서 이를 적극 검토하고, 수용해 줄 것을 호소했다. 특히 축산농가들과 대립하고 있는 농림축산식품부도 축산농가, 사료업계에 대한 지원 필요성에는 공감하고 있어 농가들의 호소에 국회 및 예산당국의 움직임에 귀추가 주목되고 있다.저작권자 © 양돈타임스 무단전재 및 재배포 금지김현구다른기사 보기 "
2022.05.23 09:13,오늘의 뉴스,http://www.pigtimes.co.kr/news/articleView.html?idxno=45649,"자조금, 국회 생생 텃밭 지원","한돈자조금이 국회 생생 텃밭 가꾸기에 한돈 새참 지원 등 함께 땀을 흘렸다.한돈자조금관리위원회(위원장 손세희)는 최근 국회 헌정기념관 앞에서 열린 ‘국회 생생텃밭’ 개장식에 참석하고 여야 국회의원들과 직접 텃밭을 가꾸며 상호 소통의 시간을 가졌다. 국회 생생텃밭은 생산적인 국회 문화 조성과 도농상생의 가치를 실현하기 위해 2015년 이래 지속적으로 조성해오고 있다.한돈자조금은 매년 겨울 국회 생생텃밭 모임과 함께 한돈 김장나눔 행사를 개최해온 데 이어, 올해는 참가자들에게 영양소가 풍부한 한돈 새참을 지원했다.이번 개장식에는 김인중 농림축산식품부 차관, 우상호 국회의원(국회 생생텃밭 회장), 신정훈·엄태영 국회의원(국회 생생텃밭 간사), 손세희 한돈자조금관리위원장 등 여야 국회의원, 봉사자 총 100여 명이 참석한 가운데 진행됐다. 참가자들은 채소 모종을 심고 꽃 모종 나눔 활동을 진행한 후 한돈으로 만든 삼겹수육, 잡채 등의 새참을 나누며 상생의 의미를 다졌다.이날 손세희 위원장은 “직접 땀 흘려 가꾸는 생생텃밭으로 하여금 우리 농업과 농촌의 소중함을 다시 한 번 느끼는 계기가 되었다”며 “나아가 이번 정부와 활발히 소통해 한돈산업 가치 확산에 최선을 다하겠다”고 말했다.저작권자 © 양돈타임스 무단전재 및 재배포 금지김현구다른기사 보기 "
2022.05.24 09:26,오늘의 뉴스,http://www.pigtimes.co.kr/news/articleView.html?idxno=45650,한돈 강세에도 수출은 계속돼야,"최근 한돈가격 강세로 돼지 지육 수출 여건이 어려워지고 있다. 이에 한돈자조금이 수출이 지속적으로 추진될 수 있도록 수출 업체를 지원키로 했다.육류유통업계에 따르면 최근 한돈가격 급등으로 국내 지육 뒷다리 유통가격은 kg당 3천400~3천500원을 형성하고 있다. 그러나 한돈 뒷다리 수출 가격은 2천800~2천900원을 형성하면서 국내 유통가격보다 되레 낮아 약 600원의 차액이 발생하고 있다. 이에 지난해부터 한돈 뒷다리 수출업체는 수출 중단 또는 적자를 감수하면서 수출을 추진하고 있다.수출업체의 한 관계자는 “한돈 수출은 단기적이 아닌 지속적인 지원이 필요한 사업으로 특히 수출국 바이어와의 유대 관계가 매우 중요하다”며 “이에 장기적인 방안에서 국내 돼지를 외국에 수출하는데 일부 지원을 통해 수출이 지속적으로 추진될 수 있도록 업계가 관심을 가져야한다”고 주장했다.이에 한돈자조금관리위원회는 이 같은 수출업체들의 요청을 받아 들여 한돈 뒷다리살 수출 지원 사업을 추진키로 했다. 우선 올 하반기 총 3억원의 예산을 반영해, 수출가격과 국내 유통가격 차액의 50%를 지원키로 했다. 즉 차액 600원의 50%인 kg당 300원을 부담키로 한 것.이를 통해 한돈 뒷다리 수출 활성화에 기여하고 뒷다리 적체 해소 및 한돈 가격 안정에도 도모할 계획이다. 한편 작년 한돈 뒷다리 수출물량은 약 1천400톤으로 연간 후지 생산량 28만톤 대비 0.7%로 파악되고 있다.저작권자 © 양돈타임스 무단전재 및 재배포 금지김현구다른기사 보기 "
2022.05.23 09:16,오늘의 뉴스,http://www.pigtimes.co.kr/news/articleView.html?idxno=45651,입국 규제 완화…ASF도 들어올라,"해외여행 빗장이 풀리면서 가축전염병 유입에 대한 우려도 높아지고 있다.농림축산식품부는 내달부터 입국규제 완화로 국제선 항공편 수가 큰 폭으로 늘어날 것으로 예상하고 ASF 등 가축전염병 유입을 막기 위한 국경 검역을 강화키로 했다.이를 위해 국제공항 8곳(인천·김포·청주·양양·대구·김해·무안·제주)과 항만 6곳(인천·평택·군산·부산·제주·속초)에서 사각지대가 없도록 국경검역 체계를 재정비한다. 또 외국인 근로자, 이주민, 유학생들에게 휴대 농축산물을 신고해야 한다고 적극 알리고 이를 어길 경우 최대 1천만원의 과태료를 부과할 계획이다.반입이 금지된 축산물은 고기류는 물론 햄, 소시지, 족발, 순대 등 가공품도 포함된다. 이를 미신고할 경우 ASF 발생국 산 돼지고기 및 관련 제품은 1차 500만원, 2차 750만원, 3차 1천만원이 부과된다. 그 외 축산물은 최대 500만원의 과태료가 메겨진다.농축산부 관계자는 “해외 여행 시 현지 농장 방문과 축산물 국내 반입을 자제해 달라”고 당부했다.저작권자 © 양돈타임스 무단전재 및 재배포 금지임정은다른기사 보기 "
2022.05.26 18:20,칼럼,http://www.pigtimes.co.kr/news/articleView.html?idxno=45652,[칼럼] 동물성단백질 ‘안보’ 무시 말라,"지난주 세계은행은 “3년간 식량과 에너지 가격은 상승할 것”이라고 언론이 보도했다. 밀 보리 옥수수 대두 등 곡물 가격은 크게 오른 반면 쌀 가격 움직임은 미미하다. 설상가상으로 세계 3위 밀 생산국인 인도가 밀 수출을 금지하고 나섰다. 밀은 빵 라면 과자 등 주요 원료다. 빵을 주요 식량으로 이용하고 있는 국가는 밀 가격이 안정돼야 가정이나 나라 모두 평안하다.한국도 이에 영향을 받고 있지만, 유럽이나 아프리카 북부 국가만큼 크지는 않다. 밀보다 쌀이 주(主)소비여서다. 20년 기준 1인당 쌀 소비량은 57.7kg이다. 밀 소비량은 19년 기준 34.2kg이다. 쌀의 67% 수준이다. 따라서 밀값이 상승한다 해도 튀니지나 이집트처럼 ‘난리’ 나지 않는다.문제는 옥수수 대두 등 사료곡물의 가격 상승이다. 밀 가격이 오르면서 덩달아 오르기 때문이다. 그래서 그것을 먹고 자란 가축의 육류값이 더 걱정된다. 20년 기준 1인당 육류 소비량은 54.3kg로 쌀 소비의 94% 수준이다. 그런데 더욱 염려되는 것은 갈수록 육류 소비는 증가할 여지가 높아서다. 농촌경제연구원도 그렇게 전망했다.알다시피 육류는 인간에게 필요한 동물성단백질 형성에 도움을 주고 있다. 육류를 섭취해야 만이 골격이 커진다. 일본이 메이지 유신 이후 육류섭취를 허용하면서 일본인 키나 체중 등이 커졌다는 사실이 이를 입증해주고 있다. 한국 역시 마찬가지다. 1970년대 후반 축산진흥정책에 따른 육류 확대 공급과 밀 소비 급증이 맞물리면서 한국인 체구도 많이 달라졌다. 서구인과 맞서게 됐다. 이제 한국 국민에게 있어 동물성단백질 안정적 확보는 아주 중요한 과제가 됐다. ‘동물성단백질’ 안보란 주장이 자연스럽고 설득력있게 대두되고 있는 것이다.그런데 정부의 대응은 미흡하다. 중요성을 인식하지 못하고 간과하고 있다. 육류의 주원료인 사료곡물값이 급등했음에도 정부는 사룟값 이자 보전(63억원 책정)등 소극적으로 대처하고 있다. 사료곡물 해외 재배 등 원대한 계획도 세우지만, 이는 현실성이 떨어진다. 국가가 나서도 어려운 판에 단체나 몇몇 회사들이 해외에서 사료곡물을 재배, 수입한다는 것은 듣기 좋은 ‘말’에 지나치지 않는다.그런 돈이 어디 있겠고, 만에 하나 곡물이 폭락할 경우 단체나 개인이 그 피해를 감당할 수 없기 때문이다. 재배한다 해도 국내 사용량의 ‘새 발의 피’ 수준이다. 그래서 국내 업체들은 해외 시황을 면밀이 분석하고 미리미리 선물로 구매, 대응하고 있다. 이것도 지금처럼 강세일 경우에는 큰 효과를 보지 못하고 있다.앞서 말했듯이 육류 소비는 국민 건강의 동물성단백질 안보와 직결된다. ‘안보’는 개인 중심이 아니다. 국방안보처럼 국가가 나서서 보호하고 책임을 져야 한다. 정부는 그런 관점에서 사료곡물값 상승을 봐야 제대로 된 정책과 대책을 세울 수 있다. 간과하지 않았으면 하는 마음 간절하다.저작권자 © 양돈타임스 무단전재 및 재배포 금지김오환다른기사 보기 "
2022.05.23 09:35,시세,http://www.pigtimes.co.kr/news/articleView.html?idxno=45653,[주간시황] 당분간 출하 주도 시장,"5월 한돈 평균 가격이 11년 만에 6천원대 시세를 기록할 것으로 보인다. 지난주 지육 kg당 가격(탕박 기준, 제주 제외)을 보면 16일 6천369원, 17일 6천508원, 18일 6천329원, 19일 6천462원, 20일 6천258원을 형성했다. 최근 돼지 값은 가정의 달 연휴 이후 소비가 주춤한 영향으로 가파른 상승세는 한 풀 꺾였으나, 산지 출하물량 감소세 영향으로 여전히 6천원대의 강세를 형성하고 있다.5월 셋째 주(5월16일~5월20일) 산지 출하물량은 총 28만3천626두(일평균 7만159두)로, 전주(5월9일~5월13일) 35만8천54두(〃7만1천610두) 대비 일 평균 출하물량은 2.1% 감소했다. 전국 축산물 도매시장에서 거래된 비육돈도 총 8천422두(일평균 1천684두)가 출하, 전주 9천481두(〃1천896두)에 비해 12.6% 감소했다. 그럼에도 지육 kg당 탕박 평균 가격(제주 제외)은 6천389원으로 전주 6천421원에 견줘 32원 하락했다.한돈 삼겹 소비자 가격은 축산물품질평가원에 따르면 5월 20일 기준 100g당 2천841원을 형성, 전달(2천353원) 대비 높게 형성하고 있다. 전년 동월(2천451원) 대비해서도 15% 가량 높게 형성되고 있다.5월 한돈가격이 2011년 5월 6천949원(탕박+박피)을 기록한 이후 11년 만에 평균 6천원대 시세를 기록하고 있다. 지난 11년에는 전국 구제역 발생으로 330만여두를 살처분 한 이후 한돈 공급 물량이 크게 감소하면서 돼짓값도 크게 상승했다.이번 6천원대 시세는 11년 공급 부족 요인과는 다르게, 수요가 크게 증가한 원인으로 풀이된다. 코로나 방역 종료 이후 외식 증가에다 가정의 달 수요까지 겹치면서 일시적으로 수요가 크게 증가했다. 이에 육가공업계에서의 물량 확보 경쟁이 치열해지면서 한돈가격도 급등한 것이다. 그러나 최근 돼짓값 급등에 삼겹 소비자가격 역시 사상 최고를 형성하면서 시장 저항 및 수입 증가를 부추기는 부작용이 발생하고 있다.이번주 한돈가격은 연휴 이후 소비가 주춤하고 있지만, 산지 출하물량 감소세에 따라 소비보다는 공급주도의 시장이 형성될 것으로 보여, 도매시장 출하물량 추이에 따른 시장 흐름이 예상된다.5월 16일~20일 도매시장 경락두수 및 경락가격"
2022.05.24 09:23,시세,http://www.pigtimes.co.kr/news/articleView.html?idxno=45654,[5월 23일 시세] 6천원대 강보합 지속,"축산물품질평가원에 따르면 5월 23일 전국 축산물 도매시장(제주 제외)에서 경락된 비육돈은 1천922두로 전일 1천250두와 비교해 증가했다. 이에 따라 지육 kg당 탕박 평균 가격(제주 제외)은 6천293원을 기록하며 전일 6천258원보다 35원 상승했다.한돈가격이 6천원대를 지속하고 있다. 한돈 산지 가격 상승에 따른 삼겹 소비자가격 상승으로 한돈소비도 주춤, 6천원 중반대서 초반대로 하향세를 보이고 있다. 6월 선거 및 연휴 도래로 다시 소비는 늘 것으로 전망, 6천원대 안팎은 지속 유지할 것으로 전망된다. 저작권자 © 양돈타임스 무단전재 및 재배포 금지양돈타임스다른기사 보기 "
2022.05.25 09:01,시세,http://www.pigtimes.co.kr/news/articleView.html?idxno=45655,[5월 24일 시세] 소비 주춤…하락세,축산물품질평가원에 따르면 5월 24일 전국 축산물 도매시장(제주 제외)에서 경락된 비육돈은 1천763두로 전일 1천922두와 비교해 감소했다. 이에 따라 지육 kg당 탕박 평균 가격(제주 제외)은 6천136원을 기록하며 전일 6천293원보다 157원 하락했다.6천원대 강세를 이어가고 있는 한돈가격은 최근 한돈 소비 주춤으로 지난주와는 다르게 내림세를 보이고 있다. 이에 도매시장 출하물량이 가장 많은 영남권에서는 5월 첫 평균 5천원대를 기록하면서 전체 한돈 평균가격도 끌어 내렸다. 소비자가격 급등으로 인한 시장 저항이 한돈강세를 주춤하게 하고 있다. 저작권자 © 양돈타임스 무단전재 및 재배포 금지양돈타임스다른기사 보기 
2022.05.25 09:03,해외양돈,http://www.pigtimes.co.kr/news/articleView.html?idxno=45656,"덴마크, 불황에 돼지 감축 본격화",덴마크 내 돼지 사육규모가 3년만에 최저치로 줄었다. 돼짓값은 불안하고 생산비는 급등하면서 양돈농가들이 돼지를 줄이고 있는 것으로 보인다.최근 덴마크 통계청에 따르면 4월 1일 기준 돼지 사육두수는 1천246만5천마리로 전년 동기(1천315만마리) 대비 5.2% 줄어 지난 19년 4월(1천217만5천마리) 이후 가장 적었다. 번식용 돼지는 120만마리로 일년전보다 5.9% 감소했다. 이처럼 돼지 사육두수가 큰 폭으로 준 것은 돼짓값이 오랜 기간 약세를 형성해온 가운데 최근에는 생산비도 급등하며 양돈 경영 불안이 높아진 때문으로 풀이된다. 이에 지난해 이미 번식돈 감소세는 본격화됐으며 그 결과 모든 구간의 돼지들이 줄었다.4월 기준 도축용 돼지들 역시 일년전보다 5~6% 가량 감소한 만큼 올해 덴마크의 돼지고기 생산량은 감소세가 확실시되고 있다. 또 모돈 두수도 크게 줄어 사육두수도 계속 줄 것으로 점쳐지고 있다.저작권자 © 양돈타임스 무단전재 및 재배포 금지임정은다른기사 보기 
2022.05.25 09:05,해외양돈,http://www.pigtimes.co.kr/news/articleView.html?idxno=45657,브라질 돈육 수출 갈수록 위축,"중국의 수입 수요 감소로 브라질 돼지고기 수출도 계속 줄고 있다.최근 브라질 동물성단백질협회에 따르면 4월 브라질 돼지고기 수출은 8만9천700으로 일년전보다 8.8% 줄고 수출액은 2억3천230만달러로 16.7% 감소했다. 지난 2월까지 일년전 실적을 웃돌던 수출이 3월 감소세로 반전한 이후 계속 줄고 있는 것이다. 이로써 4월말 돼지고기 수출량은 32만7천톤으로 전년 동기보다 7% 적었다.국가별로는 중국이 11만8천600톤으로 35%, 홍콩은 3만3천800톤으로 34.8% 각각 감소했다. 이에 필리핀(2만3천200톤 +281.3%), 싱가포르(2만톤, +43.9%), 아르헨티나(1만8천톤, +83.1%) 등 다른 나라들이 증가해도 전체 수출 실적 위축을 피할 수 없었다.저작권자 © 양돈타임스 무단전재 및 재배포 금지임정은다른기사 보기 "
2022.05.25 09:06,해외양돈,http://www.pigtimes.co.kr/news/articleView.html?idxno=45658,美 돈가 도‧소매값 ‘엇박자’,"미국의 돼짓값이 1년4개월만에 하락세로 돌아선 반면 소비자 가격은 상승세를 지속하고 있는 것으로 나타났다. 특히 이처럼 높은 소매 시세가 도매시세 하락의 원인이 될 수 있다는 지적이다.최근 미국 농무부는 5월 축산물 시장 전망 보고서를 통해 이 같이 분석했다. 지난 4월 미국 돼지 지육 도매시세(100㎏ 기준)는 234달러로 전달 대비 소폭 올랐지만 지난해 같은 기간(244.6달러)에 견줘서는 4.3% 떨어졌다. 전년 동월보다 도매시세가 하락한 것은 지난 2020년 12월 이후 처음이다. 그리고 이달 역시 계속 전년 대비 하락세를 이어가고 있다. 생산량 감소와 높은 수요가 뒷받침됐던 지난해 돼짓값이 크게 올랐던 기저효과도 있겠지만 농무부는 보고서를 통해 높은 소매시세를 그 원인 중 하나로 지목했다.미국 노동부가 발표한 4월 소비자물가지수(CPI)는 전년 대비 8.3% 올랐는데 그 중에서 돼지고기는 13.7% 상승한 것으로 집계됐다. 계란(22.6%)이나 가금육(15.3%)에 비해서는 낮지만 식품 평균(9.4%)에 비해서도 높았다. 이에 대해 농무부는 고가의 소매 가격으로 인해 소비자들이 돼지고기에서 멀어지기 시작, 도매 수요를 둔화시킨 것일 수 있다고 지적했다. 소매 업체로서는 지난해보다 더 높은 인건비, 에너지, 운송비용을 돼지고기 값에 포함시킬 수밖에 없다는 설명이다. 경제 전반에 걸친 물가 상승이 도매가격은 떨어져도 소비자 가격은 오른 배경이 되는 셈이다. 특히 소비자 입장에서는 전체 가계 예산 가운데 휘발유 등 다른 생활비들이 계속 올라 이전보다 동물성 단백질에 배분하는 생활비 비중이 줄 수 있다는 측면도 거론했다. 예산이 준만큼 돼지고기 구매를 줄이거나 다른 저렴한 고기로 대체하거나 혹은 이 둘을 조합할 수 있다는 설명이다.가격 하락의 원인을 소비 쪽에서 찾을 수밖에 없는 또 다른 이유는 생산물량 감소 때문이기도 하다. 1분기 미국의 돼지고기 생산량은 313만여톤으로 일년전(331만톤)보다 5.4% 줄었다. 그럼에도 3월말 냉동 돈육 재고물량은 지난해 동월보다 8% 증가하면서 소비가 작년만 못하다는 분석에 설득력을 높여주고 있다.저작권자 © 양돈타임스 무단전재 및 재배포 금지임정은다른기사 보기 "
2022.05.25 17:46,시세,http://www.pigtimes.co.kr/news/articleView.html?idxno=45659,[5월 25일 시세] 6천원대 아슬아슬,"축산물품질평가원에 따르면 5월 25일 전국 축산물 도매시장(제주 제외)에서 경락된 비육돈은 2천191두로 전일 1천763두와 비교해 증가했다. 이에 따라 지육 kg당 탕박 평균 가격(제주 제외)은 6천57원을 기록하며 전일 6천136원보다 79원 하락했다.5월 들어 철옹성처럼 느껴졌던 6천원대가 위태위태하다. 한돈가격은 5월 코로나 방역 해제에다 가정의 달 소비 증가로 초강세를 형성하다, 연휴 이후 삼겹 소비자가격 급등으로 인한 시장 저항을 받으면서 금주 들어 하락세로 전환되고 있다. 이에 다음주 연휴로 인한 소비 증가가 예상되지만, 5월달 처럼의 강세는 어려울 듯하다.  저작권자 © 양돈타임스 무단전재 및 재배포 금지양돈타임스다른기사 보기 "
2022.05.26 17:58,시세,http://www.pigtimes.co.kr/news/articleView.html?idxno=45660,[5월26일 시세] 하락세서 소폭 반등,"축산물품질평가원에 따르면 5월 26일 전국 축산물 도매시장(제주 제외)에서 경락된 비육돈은 1천695두로 전일 2천191두와 비교해 감소했다. 이에 따라 지육 kg당 탕박 평균 가격(제주 제외)은 6천120원을 기록하며 전일 6천57원보다 63원 상승했다.금일 소폭 반등하면서 하락세가 주춤했다. 수도권에서 한돈가격이 뒷받침되면서 한돈 평균 가격도 지지되고 있으나, 금주 들어 타권역 도매시장에서는 5천원대로 돌아서면서 한달 동안 지속된 6천원대도 이제 아슬아슬해 보인다. 저작권자 © 양돈타임스 무단전재 및 재배포 금지양돈타임스다른기사 보기 "
2022.05.26 18:33,오늘의 뉴스,http://www.pigtimes.co.kr/news/articleView.html?idxno=45662,[속보] 강원 홍천 양돈장 ASF 발생,"사진 : 한돈협 제공올해 처음으로 강원도 홍천 양돈농장서 ASF가 발생했다. 아프리카돼지열병 중앙사고수습본부(본부장 정황근 농림축산식품부장관, 이하 ‘중수본’)는 26일 강원 홍천군 소재 돼지농장(1천500여두 사육)에서 아프리카돼지열병(ASF)이 발생하였다고 밝혔다. 강원도 동물위생시험소에서 돼지 폐사체를 발견한 농장주 신고를 접수하고 해당 농장의 시료를 정밀분석한 결과, 아프리카돼지열병(ASF)으로 확진되었다.중수본은 강원 홍천 돼지농장에서 아프리카돼지열병(ASF)가 확진됨에 따라 확산차단을 위해 긴급행동지침(SOP)에 따라 발생농장에 대해서는 전 두수 살처분을 실시하고 홍천군 돼지농장(15호, 41,000여두)에 대한 긴급 정밀검사와 강원도 전체 시군 돼지농장에 대해서는 임상검사를 실시 중이다. 또한 26일 오후 6시 30분부터 5월 28일 오후 6시 30분까지 48시간 동안 경기‧강원의 돼지농장‧도축장‧사료공장‧출입차량‧관련 축산시설 등에 대해 일시이동중지명령(Standstill)을 발령하였다.정황근 중수본부장은 “최근 야생멧돼지 ASF 발생이 경기·강원을 넘어 충북·경북까지 확산된 상황으로 매우 엄중한 상황”이라며 “농식품부와 지자체 관계자는 발생농장에 대한 신속한 살처분, 경기·강원지역 일시이동중지명령 및 집중 소독 등 방역 조치에 총력을 기울여 주고, 전국 돼지농가에서는 철저한 농장 소독과 장화 갈아신기, 손소독 등 방역수칙을 준수하여 줄 것”을 강조하였다.저작권자 © 양돈타임스 무단전재 및 재배포 금지김현구다른기사 보기 "
