time,theme,url,title,article
2022.06.07 09:06,오늘의 뉴스,http://www.pigtimes.co.kr/news/articleView.html?idxno=45700,한돈협 “돈육 할당관세 실효성 의문”,"한돈협회가 정부의 돼지고기 할당관세 정책 실효성에 의문을 제기하며, 한돈 등 축산물 원가 절감을 위한 정책 병행을 요구했다.기획재정부는 지난달 30일 열린 경제관계장관회의를 통해 물가 안정을 위해 돼지고기 등 14개 품목에 대해 할당관세를 적용키로 했다. 이에 돼지고기의 경우 연말까지 5만톤에 대해 22.5~25%인 관세를 한시적으로 0%를 적용키로 했다. 또한 사료구매자금 1조5천억원을 2차 보전방식으로 지원하며 기존 사료자금 금리(1.8%)보다 낮은 1%로 낮춰 적용키로 했다.이와 관련, 한돈협회는 최근 설명자료를 통해 정부가 추진하는 할당관세 물가정책으로 돼지고기 가격이 20%가량 하락할 것으로 기대하지만 주요 돼지고기 수입국이 FTA 체결국이라 실효성이 부족할 것이라고 주장했다. 그러면서 물가안정만을 목적으로 할당관세 정책 남발하게 되면 해외 수입 축산물과의 경쟁, 생산비 상승으로 어려움을 겪는 국내 축산농가의 경영난을 심화시키고, 국내 축산업 기반을 무너뜨리는 원인이 될 수 있을 것이라고 지적했다.일례로 지난 12년 구제역으로 인한 삼겹살 파동, 2021년 AI로 인한 계란 수입 파동 모두 소비자 편익은 거의 없이 축산농가 피해가 가중되었던 사례가 반복될 수 있다는 것.이에 협회는 정부가 물가안정을 이유로 수입 축산물에만 지원할 것이 아니라 국내 축산물도 저렴한 가격에 소비자에 공급할 수 있도록 원가절감을 위한 △사료구매자금 지원확대 △학교급식비 지원확대 등 수입 축산물과 경쟁할 수 있도록 국내 축산물 공급안정 대책도 동시에 제공되어야 한다고 주장하고 있다.저작권자 © 양돈타임스 무단전재 및 재배포 금지김현구다른기사 보기 "
2022.06.15 18:02,오늘의 뉴스,http://www.pigtimes.co.kr/news/articleView.html?idxno=45701,“삼겹 오르면 목살 먹지요”,"최근 금겹살 프레임이 강화되고 있는 가운데 소비자들 대다수는 삼겹살 가격 상승 시 대체제로 한돈 목살을 선택할 것으로 조사됐다. 다만 10명 중 한명 가량은 한돈 삼겹살 대신 수입산 삼겹살을 선택하겠다고 응답, 한돈 가격 상승이 수입산으로 수요가 이동하는 원인이 되는 것으로 나타났다.축산물품질평가원이 지난달 14~19일까지 전국 성인남녀 700명을 대상으로 사회적 거리두기 이후 축산물 소비 의향을 조사해 그 결과를 발표했다. 이에 따르면 국내산 삼겹살 가격 상승 시 대체 부위를 묻는 질문에 1순위로 목살을 선택한 비율이 38.4%로 가장 높았으며 그 다음으로 앞다리와 수입산 삼겹살이 각각 9.4%로 목살 다음으로 많은 선택을 받았다. 비싸도 국내산 삼겹살을 먹을 것이란 답변이 10.3%로 수입산 삼겹살에 비해서는 다소 비중이 높았다.그러나 갈비(7.9%), 등심(4.9%), 항정살(4.7%) 등 한돈 다른 부위에 비하면 수입산 삼겹살에 대한 선호도가 월등히 높았다. 이는 한돈 삼겹살 가격 상승이 수입산 삼겹살에 유리하게 작용할 수 있다는 사실을 보여주는 셈이다.이와 함께 사회적 거리두기 해제 이후 축산물 소비 방법에서 어떤 변화가 있었는지를 조사한 결과 고기류를 외식을 통해 소비하는 빈도가 늘었다는 답변이 43.3%로 변화 없거나(37.7%), 줄었다(19%)는 응답에 비해 월등히 높았다.이에 비해 신선육을 비롯해 간편식, 밀키트, 배달 포장 등의 경우 거리두기 해제 이후 이용 빈도가 증가했다는 답변에 비해 변화없거나 감소했다는 응답이 더 높아 거리두기 해제가 상대적으로 외식 소비에 유리하게 작용한 것으로 분석되고 있다.저작권자 © 양돈타임스 무단전재 및 재배포 금지임정은다른기사 보기 "
2022.06.03 18:08,오늘의 뉴스,http://www.pigtimes.co.kr/news/articleView.html?idxno=45702,5월 한돈 ‘봄날 이었다',"5월 돼지 출하물량 증가에도 돼짓값은 한달 내내 6천원대를 지키며 강세를 지속했다.최근 축산물품질평가원에 따르면 5월 돼지 출하물량은 152만8천마리로 전달 154만마리에 비해서는 0.8% 가량 줄었지만 지난해 동월 144만마리에 견줘서는 6% 증가했다. 이로써 5월말 돼지 출하물량은 783만마리로 지난해 동기간 769만마리에 비해 1.8% 가량 많았다.특히 역대 5월 돼지 출하두수 기록 중 올해가 최고치를 기록했다. 이는 올해 근로자의 날과 부처님 오신날이 모두 일요일이었던만큼 다른 해보다 작업일수가 많았던 영향이 크다. 이에 출하물량을 일평균으로 따지면 올해 7만3천여마리로 7만6천여마리에 달했던 지난해보다 적었다.이런 가운데 돼짓값은 4월 25일 6천원대 진입한 이후 5월 한달 내내 6천원대를 지켰다. 이에 한달 평균 돼짓값은 6천385원으로 한달전 5천251원에 비해 21.6%, 지난해 동월 4천991원 대비 28% 높았다.저작권자 © 양돈타임스 무단전재 및 재배포 금지임정은다른기사 보기 "
2022.06.07 16:29,해외양돈,http://www.pigtimes.co.kr/news/articleView.html?idxno=45703,"브라질, 韓 돈육 할당관세에 반색","브라질 양돈업계가 올해 돼지고기 수출 부진을 겪고 있는 가운데 한국의 할당관세 소식에 반색하고 있다.브라질 동물 단백질 협회는 최근 보도자료를 통해 한국 정부가 이달부터 돼지고기 5만톤을 무관세 수입키로 했다고 지적하면서 브라질 돼지고기가 그 혜택을 받을 수 있다고 분석 발표했다. 특히 브라질은 현재 한국 수출이 산타카타리나 주에 한정된 것과 관련, 백신 접종 없는 구제역 청정지역으로 인정된 파라나와 리오그란데두술도 수출 가능 지역에 포함될 것으로 기대한다고 지적했다.올해 브라질의 돼지고기 생산은 증가했지만 동시에 수출은 4월까지 32만7천톤으로 전년 동기 대비 7% 감소했다. 이는 전적으로 중국의 수요가 준 때문인데 중요한 것은 이로 인해 대체 시장이 어느 때보다 필요한 상황이라는 점이다. 이런 가운데 한국의 할당관세 시행이 솔깃한 소식이 되고 있는 것이다. 협회는 지난해 브라질 무역투자진흥공사(ApexBrasil) 및 주한 브라질 대사관과 함께 브라질 돼지고기 홍보 활동을 펼친바 있다.저작권자 © 양돈타임스 무단전재 및 재배포 금지임정은다른기사 보기 "
2022.06.09 09:19,오늘의 뉴스,http://www.pigtimes.co.kr/news/articleView.html?idxno=45704,성적 하위 농가 고생산비 직격탄,"올해 고돈가‧고생산비 속 최근 국내 양돈장간 상‧하위 성적 격차가 벌어지면서 ‘부익부 빈익빈’ 현상이 심화되고 있다. 하위농가의 경우 상위 농가 대비 출하두수가 적고 출하일령이 늦어 최근 고돈가 ‧고생산비 속 농장 수익에도 큰 영향을 미치고 있다. 한돈협회가 운영 중인 한돈팜스 1분기 보고서에 따르면 최근 1년간(21년 3월~22년 2월) 상‧하위 농가 연간 MSY를 비교 분석한 자료에 따르면 △상위 농가(10~30%)=21.3~23.4두 △하위 농가(10~30%)=12.8~14.0두로 나타나면서 최대 10.6두로 나타났다.특히 올해 1분기의 경우 상하위 농가간 격차가 평균에 비해 더 벌어졌다. 올 3월의 경우 상‧하위 10%간 성적은 24.1두, 12.9두로 최대 11.2두 차이났다. 즉 올해 돈가 상승 분위기에 성적 상위 농가 그룹은 출하물량 증가로 수익이 증가했지만, 반면 하위 그룹 생산 성적 농가들은 제 때 출하할 돼지가 없는 것이다.특히 올해와 같은 고생산비 속 출하일령도 늦어 생산비가 크게 늘고 있다는 분석이다. 상위 10% 농가의 출하일령은 166일로 하위 10% 농가는 235일로 무려 69일이 빨랐다. 출하일령이 늦는다는 것은 그 만큼 생산비가 더 가중된다는 것이다. 이에 고돈가‧고생산비 속 성적 하위 농가는 직격탄을 맞으며 경영 위기가 가중되고 있는 것으로 분석된다."
2022.06.07 16:30,해외양돈,http://www.pigtimes.co.kr/news/articleView.html?idxno=45705,EU 돼지고기 수출 29% 감소,"EU(유럽연합)의 돼지고기 수출이 올해 큰 폭으로 줄었다. 단 중국이 급감했지만 나머지 국가에서는 일제히 큰 폭으로 증가했으며 그 중에서도 한국이 단연 돋보이는 신장세를 보였다.최근 EU 위원회에 따르면 3월말 돼지고기 수출은 114만3천톤으로 지난해 같은 기간 160만톤에 비해 28.7% 감소했다. 특히 EU 내 최대 수출국인 스페인의 수출이 일년전보다 32% 가량 감소하면서 수출 부진이 더 심했다. 또 3월 수출은 19년 이후 처음으로 30만톤대로 줄면서 지난 5년 동기간 평균에 비해서도 수출물량이 적었다.수출 시장별로는 중국이 35만3천톤으로 일년전 95만8천톤 대비 절반 이하(-63%)로 감소했다. EU 전체 돼지고기 수출 가운데 중국 비중은 지난 2020년 62%에서 지난해 48.8%로 그리고 올해 3월말 현재 30.9%로 급감했다. 여전히 최대 시장이기는 하지만 중국의 빈자리는 쉽게 채워지지 않고 있는 것이다.일본, 필리핀, 한국이 나란히 10만톤대로 중국의 뒤를 이었으며 모두 일년전보다 큰 폭으로 증가, 중국이 빠져나간 자리를 일부 메꿨다. 1분기 현재 일본은 12만4천톤으로 전년 동기보다 58.6% 늘고 필리핀과 한국은 각각 11만9천톤, 10만3천톤을 기록하면서 일년전보다 23.8%, 96% 증가했다. 한국은 이들 외에 다른 어떤 EU 수출시장보다 높은 증가율을 기록했다. 이에 EU 전체 수출 물량 중 한국 비중은 지난해 5.4%에서 올해는 1분기 현재 9%까지 올랐으며 일본과 필리핀은 각각 10.8%, 10.4%를 차지했다.한편 EU의 돼짓값은 4월 마지막주 100㎏ 기준 191.5유로까지 올랐으나 5월은 약보합세로 전환돼 넷째주 185.4유로까지 떨어졌다. 여전히 지난해 동기간에 견줘서는 10% 이상 높은 수준이지만 수출이 지속적으로 부진하고 특히 생산비가 오르면서 EU 내 돼지 사육두수 감축이 지속되고 있는 것으로 파악되고 있다.저작권자 © 양돈타임스 무단전재 및 재배포 금지임정은다른기사 보기 "
2022.06.07 16:29,해외양돈,http://www.pigtimes.co.kr/news/articleView.html?idxno=45706,中 불황에 모돈 감축 지속,"중국의 모돈 두수가 지난 연말 이후 150만마리 이상 줄었다.최근 중국 농업농촌부에 따르면 4월 모돈 두수는 4천177만마리로 전달보다 0.2% 줄었으며 지난해 동월에 견줘서도 4.3% 적은 것으로 집계됐다. 지난해 12월(4천329만마리)과 견주면 올 4개월간 3.5%, 152만마리가 감소한 것이다. 중국 돼짓값이 여전히 생산비 이하 약세를 전전하면서 지속적으로 모돈 감축이 이뤄지고 있는 것으로 분석되고 있다. 이에 일각에서는 조만간 중국 돼짓값이 다시 오르고 수입을 늘릴 수 있다는 전망도 나오고 있다.한편 중국 돼지고기 도매시장 가격은 5월 넷째주(23~29일) 21.16위안으로 6주 연속 상승세를 기록했다.저작권자 © 양돈타임스 무단전재 및 재배포 금지임정은다른기사 보기 "
2022.06.07 16:29,해외양돈,http://www.pigtimes.co.kr/news/articleView.html?idxno=45707,베트남 세계 첫 ASF 백신 출시,"베트남이 세계 최초로 ASF 백신 개발에 성공해 상용화에 나섰다. 한국을 비롯해 세계 여러나라에서 양돈산업을 위협하고 있는 ASF의 방역에 획기적 전기가 될지 주목되고 있다.최근 외신에 따르면 지난 3일 베트남 농업농촌개발부는 ASF 백신 개발에 성공, 정식 출시한다고 밝혔다. 이는 세계 최초의 ASF 백신으로 베트남은 이번 성과가 수의학 산업의 이정표이자 전 세계적 양돈산업의 방패라고 평가하고 있다.해당 백신은 베트남 Navetco 중앙수의약품 주식회사의 ‘NAVET-ASFVAC’이다. 이 백신은 그동안 5회의 실험실 테스트에서 효과가 확인됐으며 지난달 미국 농업연구원으로부터 안전성과 효과에 대한 공식 확인을 받은 것으로 알려졌다. 면역은 6개월 지속된다는 설명이다.베트남은 이 백신을 메콩 삼각주 등 일부 지역에 60만두분을 먼저 공급한 후 전국으로 확대한다는 방침이며 향후 백신의 수출도 모색한다는 계획이다.저작권자 © 양돈타임스 무단전재 및 재배포 금지임정은다른기사 보기 "
2022.06.07 16:29,해외양돈,http://www.pigtimes.co.kr/news/articleView.html?idxno=45708,러시아 올해 돼짓값 하락 전환,"빠른 성장세를 보이던 러시아 양돈업도 불황의 그늘이 짙어지고 있다.최근 농수산물유통공사는 러시아 전국양돈육종자연맹(NUS)의 발표 자료를 인용, 지난달 16~22일 주간 돼지가격이 ㎏당 105루블로 전주보다 9%, 전년 동기에 비해서는 20% 하락했다고 밝혔다.지난해만해도 러시아 서부 기준 냉장 돈육의 평균 가격은 ㎏당 124.83루블로 전년 대비 25% 올랐다. 2020년 코로나 펜데믹으로 해외 관광이 중단되면서 국내 소비가 늘었고 21년에는 ASF로 돼지고기 생산물량이 다소 감소한 영향까지 더해진 결과라는 설명이다. 그런데 올해 이처럼 가격이 하락한 것은 공급량 증가 때문으로 지적되고 있다. 올 1분기 조직화된 농업 생산자의 돼지고기 생산량이 123만톤으로 전년 대비 5.8% 증가했다. 거기다 올해 냉동 돈육의 면세 수입허가도 가격 하락 원인이 된 것으로 분석되고 있다.문제는 러시아 역시 돼지 생산비가 지난 2년간 30% 가량 크게 오르면서 이 같은 돈가 하락이 양돈 생산자들의 수익성을 심각하게 압박하고 있다는 점이다. 올해 러시아의 돼지고기 생산량은 7~8% 가량 증가할 것으로 추산되고 있어 양돈업계의 불황 탈출이 쉽지 않을 것으로 전망되고 있다.저작권자 © 양돈타임스 무단전재 및 재배포 금지임정은다른기사 보기 "
2022.06.06 10:04,양돈기업,http://www.pigtimes.co.kr/news/articleView.html?idxno=45709,"천하제일사료 ""농가 쿨한 여름 약속합니다""","천하제일사료(대표 권천년)가 전사적으로 Cool Summer Project(쿨 썸머 프로젝트)를 통해 하절기 문제 극복 및 고객 지원에 대한 적극적인 의지와 실천력을 동시에 선보이고 있다.금번 프로젝트는 하절기 고온 스트레스의 영향으로 매년 반복되는 섭취량 및 생산 관련 성적 저하 등의 여러 난관을 슬기롭고 선제적으로 해결하고자 이달부터 3개월 동안 시행된다. 특히 ‘2022 천하제일 쿨 썸머 프로젝트’는 한 축종에만 한정되는 것이 아니라 전사적으로 모든 축종팀과 함께 프로젝트를 진행해 하절기 생산성 향상이라는 통일된 목표로 전 임직원이 한 마음 한 뜻으로 뜨거운 여름보다 더 강렬한 열정을 불태울 예정이다.그 중 양돈 부문에서는 고온기 대사 스트레스 감소 및 섭취량 증대를 위한 하절기 보강 조치를 실시함에 따라 농장의 생산성적 개선(비육 성적 개선 및 번식 성적 개선)을 이끌 예정이다. 이러한 제품 보강 조치 외에도 하절기에 겪는 고질적인 문제인 출하지연 및 밀사를 해결하기 위해 음수종합점검 서비스를 비롯한 3아웃 활동캠페인을 실시한다. 이처럼 다방면 활동을 통해 농장의 생산성 및 수익성을 개선하는 데 집중할 예정이다.‘쿨 썸머 프로젝트’를 기획 및 주관한 마케팅실은 “사계절 중 가장 관리가 힘든 시기인 여름은 전 축종에 걸쳐 생산성 저하 문제를 유발하고 폭염으로 인한 가축의 폐사문제가 대두되는, 가장 큰 주의를 요하는 시기”라며 “여름철 섭취량 저하로 인한 고객들의 고민거리를 해결하고 영업 현장의 역동적인 활동을 보다 적극 지원하고 다양한 솔루션을 제공하고자 금번 캠페인을 진행하게 되었다”고 밝혔다.저작권자 © 양돈타임스 무단전재 및 재배포 금지양돈타임스다른기사 보기 "
2022.06.09 09:18,칼럼,http://www.pigtimes.co.kr/news/articleView.html?idxno=45710,[칼럼] 돈육 할당관세는 본질을 벗어난 정책,"정부는 돼짓값 안정을 위해 12월말까지 돈육 5만톤에 대해 할당관세(22.5~25%%에서 0%로)를 적용키로 했다. 정부는 2011년 구제역 재발로 한돈 가격이 급등하자 MB 정부가 사용한 정책을 다시 꺼낸 것이다. 할당관세가 마치 물가안정의 전가(傳家)의 보도(寶刀)인양 이용하고 있다. 하지만 이번에는 효과가 있더라도 ‘큰’ 효과를 발휘하지 못할 것 같다. 상황이 다르고 관세가 달라서다.한국의 돼지고기 수입 주요 국가를 보면 미국과 유럽이다. 이들 나라를 통해 돼지고기 수입 90% 이상이 들어오고 있다. 이들 국가에 대한 돈육 관세는 FTA로 거의 무관세다. 22.5~25%의 관세를 내고 돈육을 수입해야 하는 나라는 캐나다 멕시코 브라질 등 일부 국가다.이런 상황에서 국내 돈육 수입업자(체)들이 캐나다 등에서 수입하려면 새로운 돈육 공급책을 찾아야 하는데 몇 달 사이 쉽게 찾을지 의문이 든다. 설령 공급책을 만난다 하더라도 가격이 맞을는지 판단이 안 선다. 세계 돼짓값이 크게 오른 이때, 이들 국가의 돈육 공급책이 한국의 물가안정을 위해 ‘출혈(出血)’하면서까지 저가로 공급할 여지는 거의 없기 때문이다. 이를 보면 돈육 할당관세 조치는 영향이 크지 않을 것 같다.하지만 우려되는 부분은 5만톤 할당관세에도 국내 돼지고기 가격이 강세를 유지할 경우 할당관세 물량과 기간을 늘릴 가능성을 배제할 수 없다는 점이다. 그럼으로써 국내 돈육 수입업자(체)들이 한돈보다 할당관세를 통한 돈육 수입가격이 쌀 경우 무턱대고 수입할 때 한돈 하락은 불가피하다. 그로 인해 국내 전체 돈육 재고가 늘면서 내년 돼짓값에 긍정적 요인으로 작용하지 않을 것으로 판단된다.사실 할당관세는 국제 원자재가 급등, 이를 수입 가공 공급함으로써 국내 가계(家計) 살림에 미치는 영향이 클 때 적용하는 제도다. 예를 들면 사료용 옥수수에 대해 할당관세를 적용하지 않고 정부의 방침대로 수십%의 관세를 부과할 경우 그것이 배합사료로, 축산물로 전가(轉嫁)돼 가정의 경제에 악영향을 끼치기 때문에 옥수수 등 주요 사료원료에 대해 정부는 할당관세를 적용하고 있는 것이다.그래서 그런 할당관세를 소비자의 최종 산물인 돈육에 대해 적용하는 것은 ‘땜질 처방’이며 ‘동족방뇨(凍足放尿 : 언 발에 오줌 누기’ 정책이라고 비난 비판하고 있다. 본질(本質)을 벗어난 정책이라고도 지적받고 있다.돼지고기 수급 정책은 국외보다 국내에서 찾아야 한다. 적정 자급률을 유지하면서 수입에 의존해야 한다. 수차 강조했듯이 한돈은 국민 건강에 꼭 필요한 동물질단백질 공급원이기 때문이다. 이를 위한 시급한 정책은 허가제 등 규제를 푸는 길밖에 없다. 양돈업 신규 진출과 기존 농가의 신증축을 완화해야 한다. 그럴 때 돈육의 할당관세 정책은 불요불급(不要不急 : 필요하지 않고 급하지도 않음)할 것이다.저작권자 © 양돈타임스 무단전재 및 재배포 금지김오환다른기사 보기 "
2022.06.09 09:18,칼럼,http://www.pigtimes.co.kr/news/articleView.html?idxno=45711,[기자의 시각] 단체와 ‘소통’해야 농정도 ‘소통’된다,"윤석열 정부의 정황근 초대 농림축산식품부장관은 지난 2일 취임이 채 한달도 지나지 않은 시점에서 농업인단체와의 간담회를 개최했다.이번 간담회에 참석한 한돈협회 등 농업인단체들은 큰 기대감을 갖고 참석, 농정 현안에 대해 논의했다. 정 장관은 모두 발언을 통해 ‘소통’을 강조했다. 농업인단체장들에게 같은 배를 탔다며, 앞으로 자주 만나고, 접촉하고, 고민을 털어놓고 대안을 마련하자고 강조했다. 그러면서 필요하다면 장관의 직통 전화도 반드시 받겠다고 덧붙였다.이날 정 장관의 ‘소통’ 강조 발언 배경에는 이전 정부의 소통 부족을 간접적으로 시인한 것으로 풀이된다. 일례로 축산관련단체들은 이전 정부를 독불 농정이라고까지 비판했으며, 한돈협회도 장관과의 대화를 위해 수차례 면담을 신청했으나, 받아들이지 않으면서 답답해한 바 있다.이에 새 정부는 이전 정부의 소통 부재를 인식하면서 첫 상견례자리부터 ‘소통’을 강조한 것이다.그러나 정 장관의 의중과 달리 여전히 농축산부 실무자들은 실질적인 소통을 하고 싶은 지 의문이 들었다. 이날 행사 현수막에는 ‘장관님과 농업인단체장 농정 소통 간담회’라고 적시, 농축산부가 현재 어떻게 농업인을 인식하고 있는 지 엿볼 수 있었다. 또한 37개 농업인단체장들이 참석했지만, 발언 시간이 매우 부족하면서 각 산업의 애로사항을 새로운 장관에게 전달할 수 없었다.그럼에도 이번 정부의 농정은 기대가 된다. 정 장관이 농민과의 소통을 강조하고, 농업에 대한 청사진을 이날 밝혔기 때문이다. 앞으로 농축산부의 ‘장관님’이 아닌 농업인들에게 장관으로서의 자신만의 철학을 통한 소통 농정을 펼치길 기대해본다.저작권자 © 양돈타임스 무단전재 및 재배포 금지김현구다른기사 보기 "
2022.06.07 09:05,오늘의 뉴스,http://www.pigtimes.co.kr/news/articleView.html?idxno=45712,축분 액비 활용처 다양해질까,"가축분뇨 액비의 활용에 걸림돌이 돼 왔던 질소 기준이 개선된다.농림축산식품부는 가축분뇨 액비의 활용처를 다각화하기 위해 ‘가축분뇨의 자원화 및 이용 촉진에 관한 규칙’을 일부 개정, 질소의 최소 함유량 0.1% 이상이어야 한다는 기준을 삭제했다.액비는 축분을 호기성 발효시킨 액상 비료로 그동안 비료관리법에 따른 비료공정규격(질소, 인산, 칼리 성분의 합계 0.3% 이상)과 가축분뇨의 자원화 및 이용 촉진에 관한 규칙의 질소 최소 함량 기준(0.1% 이상)을 모두 충족해야 했다.그런데 이번에 질소 최소 함량 기준을 삭제하고 기존의 비료공정규격의 기준만 남긴 것이다. 이는 그동안 악취 저감 노력과 부숙도 기준 도입으로 질소 함유량이 줄어드는 방향으로 현장 여건이 변화해 왔기 때문이다.농축산부는 이번 개정을 통해 골프장, 하우스 시설 등 연중 액비 살포가 가능한 수요처 발굴 효과가 기대된다고 설명했다. 액비 살포 비수기(여름철)에는 분뇨 자원화 시설에서 액비 저장조가 가득 차 분뇨를 반입하지 못하는 분뇨처리의 고질적인 문제를 해결하는데도 기여할 것이라고 덧붙였다. 농축산부는 이번 개정안을 오는 7월 3일까지 입법 예고할 방침이다.농축산부 관계자는 “액비 활용처 다각화는 축산농가 경쟁력 향상은 물론 화학비료 대체를 통한 경종 농가의 경영비 절감 및 탄소 저감으로도 이어질 것”이라고 설명했다.저작권자 © 양돈타임스 무단전재 및 재배포 금지임정은다른기사 보기 "
